{
  "$schema": "https://json-schema.org/draft/2020-12/schema",
  "title": "Schema B - Global Pick Selector to Bankroll v1.1",
  "type": "object",
  "required": [
    "selector_schema_version",
    "pick_id",
    "module_id",
    "module_version",
    "event_id",
    "match_label",
    "market_family",
    "market",
    "selection",
    "odds",
    "global_score",
    "confidence_norm",
    "risk_norm",
    "edge_norm",
    "priority_tier",
    "executive_rationale",
    "pool_status",
    "normalization_version"
  ],
  "properties": {
    "selector_schema_version": {"type": "string", "const": "selector_pick.v1.1"},
    "pick_id": {"type": "string", "minLength": 3},
    "module_id": {"type": "string", "enum": ["v12", "corners", "btts", "cards"]},
    "module_version": {"type": "string"},
    "event_id": {"type": ["integer", "string"]},
    "match_label": {"type": "string", "minLength": 3},
    "market_family": {"type": "string", "enum": ["goals", "btts", "corners", "cards"]},
    "market": {"type": "string"},
    "selection": {"type": "string"},
    "line": {"type": ["number", "string", "null"]},
    "odds": {"type": "number", "exclusiveMinimum": 1.0},
    "global_score": {"type": "integer", "minimum": 0, "maximum": 100},
    "confidence_norm": {"type": "integer", "minimum": 1, "maximum": 5},
    "risk_norm": {"type": "integer", "minimum": 1, "maximum": 5},
    "edge_norm": {"type": "string", "enum": ["weak", "acceptable", "strong", "very_strong"]},
    "priority_tier": {"type": "string", "enum": ["Best", "Top", "Actionable", "Watchlist", "Reject"]},
    "conflict_flags": {"type": "array", "items": {"type": "string"}},
    "correlation_flags": {"type": "array", "items": {"type": "string"}},
    "executive_rationale": {"type": "string", "minLength": 10},
    "selector_decision_note": {"type": ["string", "null"]},
    "pool_status": {"type": "string", "const": "exported_to_bankroll"},
    "normalization_version": {"type": "string"}
  },
  "additionalProperties": true
}
