{
  "selector_schema_version": "selector_pick.v1.1",
  "pick_id": "corners_20260323_102",
  "module_id": "corners",
  "module_version": "corners.1.0.0",
  "event_id": 12002,
  "match_label": "Benfica vs Braga",
  "market_family": "corners",
  "market": "match_corners_over",
  "selection": "Over 8.5 Corners",
  "line": 8.5,
  "odds": 1.87,
  "global_score": 80,
  "confidence_norm": 4,
  "risk_norm": 3,
  "edge_norm": "strong",
  "priority_tier": "Top",
  "conflict_flags": [],
  "correlation_flags": ["partial_cluster_overlap"],
  "executive_rationale": "Boa pick, mas já existe cluster parcialmente relacionado no dia.",
  "selector_decision_note": "Manter sob prudência.",
  "pool_status": "exported_to_bankroll",
  "normalization_version": "norm.v1.1"
}
