{
  "selector_schema_version": "selector_pick.v1.1",
  "pick_id": "btts_20260323_103",
  "module_id": "btts",
  "module_version": "btts.0.9.9",
  "event_id": 12003,
  "match_label": "Porto vs Gil Vicente",
  "market_family": "btts",
  "market": "match_btts",
  "selection": "BTTS Yes",
  "line": null,
  "odds": 1.95,
  "global_score": 79,
  "confidence_norm": 4,
  "risk_norm": 3,
  "edge_norm": "acceptable",
  "priority_tier": "Actionable",
  "conflict_flags": [],
  "correlation_flags": [],
  "executive_rationale": "Payload válido mas fixture já deve vir bloqueada por entrada anterior.",
  "selector_decision_note": "Teste de fixture lock.",
  "pool_status": "exported_to_bankroll",
  "normalization_version": "norm.v1.1"
}
