{
  "selector_schema_version": "selector_pick.v1.1",
  "pick_id": "corners_20260323_007",
  "module_id": "corners",
  "module_version": "corners.0.9.3",
  "event_id": 878317,
  "match_label": "Osasuna vs Girona",
  "market_family": "corners",
  "market": "match_corners_under",
  "selection": "Under 10.5 Corners",
  "line": 10.5,
  "odds": 1.91,
  "global_score": 84,
  "confidence_norm": 4,
  "risk_norm": 2,
  "edge_norm": "strong",
  "priority_tier": "Top",
  "conflict_flags": [],
  "correlation_flags": [],
  "executive_rationale": "Pick tecnicamente forte, com boa consistencia, sem conflito atual de fixture.",
  "selector_decision_note": "Ranking elevado por qualidade de dados e racional claro.",
  "pool_status": "exported_to_bankroll",
  "normalization_version": "norm.v1.1"
}