{
  "selector_schema_version": "selector_pick.v1.1",
  "pick_id": "v12_20260323_011",
  "module_id": "v12",
  "module_version": "v12.0.4",
  "event_id": 991100,
  "match_label": "Roma vs Lecce",
  "market_family": "goals",
  "market": "match_under",
  "selection": "Under 3.5 Goals",
  "line": 3.5,
  "odds": 1.62,
  "global_score": 88,
  "confidence_norm": 5,
  "risk_norm": 2,
  "edge_norm": "strong",
  "priority_tier": "Best",
  "conflict_flags": [],
  "correlation_flags": [],
  "executive_rationale": "Pick muito limpa e estável na shortlist global.",
  "selector_decision_note": "Ranking premium do dia.",
  "pool_status": "exported_to_bankroll",
  "normalization_version": "norm.v1.1"
}
